<!ELEMENT biblioteca (libro*)>
<!ELEMENT libro (titulo,autor,fechaPublicacion)>
<!ELEMENT titulo (#PCDATA)>
<!ELEMENT autor (#PCDATA)>
<!ATTLIST autor fechanacimiento CDATA #IMPLIED>
<!ELEMENT fechaPublicacion (#PCDATA)>
<!ATTLIST fechaPublicacion aÃ±o CDATA #REQUIRED>
